hotel_id,name,description,lat,lon,area,type,family,couple,hot_spring,scenic,near_station,glamping,shopping,ocean_view_bath,quiet,ise_shima_access,beach_front,kids_room,private_dining
1,鳥羽温泉郷「戸田家」,海を望む老舗温泉宿で、湯めぐりと海の幸を満喫。多彩な温泉と名物バイキングが楽しめる、家族旅行にもぴったりの癒し宿。,34.48910412,136.8415347,鳥羽,温泉旅館,1,0,1,1,1,0,0,1,0,1,0,0,1
2,VISONホテル,自然と美食に包まれる次世代リゾート。話題の商業施設VISONに隣接し、三重の食・文化・癒しを一度に体験できる滞在型ホテル。,34.4593314,136.5157218,多気町,商業施設,0,1,0,0,0,0,1,0,0,0,0,0,0
3,TAOYA志摩,全室オーシャンビューの絶景温泉リゾート。ラウンジのドリンクや湯上がりサービスも充実した、何もしない贅沢を楽しむ大人のご褒美宿。,34.45093787,136.9079304,鳥羽,温泉旅館,0,1,1,1,0,0,0,1,0,1,1,1,0
4,志摩周辺ホテル「NEMU RESORT」,英虞湾を望む広大な自然リゾート。グランピングやヨガ、星空体験など、自然と一体になれるアクティビティが豊富な癒しの楽園。,34.29811991,136.7945766,志摩,リゾート,1,1,0,0,0,1,0,0,0,1,1,1,0
5,志摩グランピング「グランドーム伊勢賢島」,冷暖房完備の快適ドームで楽しむ贅沢アウトドア。伊勢志摩の自然の中でBBQや焚き火体験ができる、初心者でも安心のグランピング施設。,34.31619222,136.8198129,志摩,グランピング,1,1,0,1,0,1,0,0,1,1,0,1,1
6,賢島ホテル「志摩観光ホテル」,伊勢志摩サミット開催の格式高い名門ホテル。英虞湾の絶景と伝統のフレンチが味わえる、大人のためのラグジュアリーリゾート。,34.30801454,136.815305,賢島,リゾート,0,1,0,1,1,0,0,1,1,1,0,0,0
7,ヴィレッジ＆ホテル 志摩地中海村,まるで海外旅行気分の白い街並みリゾート。異国情緒あふれる空間で写真映えも抜群、非日常ステイが叶う人気ホテル。,34.30412715,136.8052225,志摩,商業施設,1,0,0,1,0,0,1,0,0,1,1,0,0
8,アクアイグニス素粋居,美食と温泉を極めた大人の隠れ家。料理人こだわりのグルメと洗練された空間で、心と体を整える上質なリトリート滞在。,35.01217008,136.477283,菰野,温泉旅館,0,1,1,0,1,0,1,0,1,0,0,0,0
9,ホテル季の座,熊野灘の海絶景と海の幸を堪能できる温泉宿。露天風呂と新鮮な海鮮料理が自慢の、自然に癒される和モダンな宿。,34.19831097,136.3607264,紀北町,温泉旅館,1,1,1,1,0,0,0,1,1,0,1,0,0
